{
  "schemaVersion": 2,
  "evidenceId": "pr06e-production-bootstrap-20260812T012423Z-production-validation",
  "validator": {
    "id": "paperlens-promotion-gate-validator",
    "version": "1.0.0",
    "contractVersion": 4
  },
  "phase": "current-production",
  "result": "PASS",
  "manifest": {
    "role": "current-production",
    "lifecycleState": "PRODUCTION_CURRENT",
    "path": "promotion/production/manifest.json",
    "sha256": "93f6e09fc4c0542e91d50738cb568a6a0c389edf4c87c2d861be17e3a08a4bf2"
  },
  "artifact": {
    "artifactId": "paperlens-question-corpus",
    "artifactVersion": "pr06d-c1da2430cecd-a95f5c5f5ff6",
    "path": "promotion/production/artifacts/question-corpus-v1.json",
    "sizeBytes": 4277086,
    "sha256": "56d59d2b79e93bd851226742676c28327e7aa0ecd45abc545bae0026b665f87e",
    "recordCount": 1690,
    "stableIdSetSha256": "5fc953a117094e2e711576bff9332935db3a07a5cf03e66ddd924d6c23c53784"
  },
  "schema": {
    "id": "paperlens-question-corpus-records",
    "version": 1,
    "path": "contracts/promotion/schemas/question-corpus-v1.schema.json",
    "sha256": "8eb88e79f22918a80d86bad28e322e316d03684bb69539478d908ba3aa7fe872"
  },
  "scope": {
    "supportedSyllabi": [
      "0478",
      "9618"
    ],
    "sha256": "7896a5c8d67181b2468c662fe1be08bc492bb21abc67c615350e88e7097ac1bc"
  },
  "sourceCommit": "c1da2430cecd1135d7c8388cc20b0829661eb81c",
  "generatedAt": "2026-08-12T01:24:23Z",
  "supersedes": null,
  "findings": [
    {
      "code": "PR06E_FIRST_PRODUCTION_BOOTSTRAP_EXECUTED",
      "severity": "INFO",
      "message": "First Production Bootstrap executed by paperlens-pr06e-bootstrap-executor@1.0.0 under pr06e-production-bootstrap-20260812T012423Z",
      "path": "promotion/production/artifacts/question-corpus-v1.json"
    }
  ]
}
