{
  "schemaVersion": 2,
  "evidenceId": "pr06e-bootstrap-4d2363e7df3a-56d59d2b79e9-target-preflight",
  "validator": {
    "id": "paperlens-promotion-gate-validator",
    "version": "1.0.0",
    "contractVersion": 4
  },
  "phase": "target-pre-review",
  "result": "READY_FOR_HUMAN_REVIEW",
  "manifest": {
    "role": "promotion-target",
    "lifecycleState": "READY_FOR_HUMAN_REVIEW",
    "path": "promotion/target/manifest.json",
    "sha256": "e13e2d288fcf779bedb14ddca7aaad6e127bffd915600051d5376e8bcd6e214a"
  },
  "artifact": {
    "artifactId": "paperlens-question-corpus",
    "artifactVersion": "pr06d-c1da2430cecd-a95f5c5f5ff6",
    "path": "promotion/target/artifacts/question-corpus-v1.json",
    "sizeBytes": 4277086,
    "sha256": "56d59d2b79e93bd851226742676c28327e7aa0ecd45abc545bae0026b665f87e",
    "recordCount": 1690,
    "stableIdSetSha256": "5fc953a117094e2e711576bff9332935db3a07a5cf03e66ddd924d6c23c53784"
  },
  "schema": {
    "id": "paperlens-question-corpus-records",
    "version": 1,
    "path": "contracts/promotion/schemas/question-corpus-v1.schema.json",
    "sha256": "8eb88e79f22918a80d86bad28e322e316d03684bb69539478d908ba3aa7fe872"
  },
  "scope": {
    "supportedSyllabi": [
      "0478",
      "9618"
    ],
    "sha256": "7896a5c8d67181b2468c662fe1be08bc492bb21abc67c615350e88e7097ac1bc"
  },
  "sourceCommit": "c1da2430cecd1135d7c8388cc20b0829661eb81c",
  "generatedAt": "2026-08-11T13:19:40Z",
  "supersedes": {
    "evidencePath": "promotion/target/evidence/validation.json",
    "evidenceSha256": "e18020bf922890381b8c883a79e6c360e4705c5d0277f6d6c3d5189ae2a113c9"
  },
  "findings": [
    {
      "code": "PR06E_FRESH_RUNTIME_PREFLIGHT",
      "severity": "INFO",
      "message": "Target rebound to a fresh runtime Promotion session without artifact identity drift",
      "path": "promotion/target/artifacts/question-corpus-v1.json"
    }
  ]
}
